<?xml version="1.0" encoding="UTF-8"?>
<!DOCTYPE msgr SYSTEM "msgr.dtd">
<msgr xmlns="http://graph2svg.googlecode.com"
    colorScheme="black" lineType="none">
  <title>Columns with deviations</title>
  <names>
    <name>Jan</name>
    <name>Feb</name>
    <name>Mar</name>
    <name>Apr</name>
    <name>May</name>
    <name>Jun</name>
  </names>
  <values colType="block" color="#888">
    <title>columns: colType="block" color="#888"</title>
    <value>118</value>
    <value>121</value>
    <value>122</value>
    <value>123</value>
    <value>121</value>
    <value>120</value>
  </values>
  <values>
    <title>botom of lines: none</title>
    <value>117</value>
    <value>119</value>
    <value>119.7</value>
    <value>121.4</value>
    <value>119.4</value>
    <value>119.5</value>
  </values>
  <values colType="line" startFrom="last">
    <title>top of lines: colType="line" startFrom="last"</title>
    <value>119</value>
    <value>121.9</value>
    <value>123.1</value>
    <value>124.8</value>
    <value>122.8</value>
    <value>121.1</value>
  </values>
  <values pointType="minus">
    <title>expected value: pointType="minus"</title>
    <value>117.8</value>
    <value>120.5</value>
    <value>121.8</value>
    <value>123.4</value>
    <value>120.35</value>
    <value>120.25</value>
  </values>
</msgr>