<?xml version="1.0" encoding="UTF-8"?>
<!DOCTYPE msgr SYSTEM "msgr.dtd">
<msgr xmlns="http://graph2svg.googlecode.com"
		stacked="sum" lineType="none" 
		fillArea="yes" colorScheme="cold"
	>
  <title>Production</title>
  <names>
    <name>Jan</name>
    <name>Feb</name>
    <name>Mar</name>
    <name>Apr</name>
    <name>May</name>
    <name>Jun</name>
  </names>
  <values>
    <title>product A</title>
    <value>21</value>
    <value>22</value>
    <value>18</value>
    <value>18</value>
    <value>16</value>
    <value>14</value>
  </values>
  <values>
    <title>product B</title>
    <value>10</value>
    <value>12</value>
    <value>9</value>
    <value>11</value>
    <value>15</value>
    <value>18</value>
  </values>
  <values>
    <title>product C</title>
    <value>28</value>
    <value>29</value>
    <value>22</value>
    <value>25</value>
    <value>30</value>
    <value>25</value>
  </values>
</msgr>
