<?xml version="1.0" encoding="UTF-8"?>
<!DOCTYPE msgr SYSTEM "msgr.dtd">
<msgr xmlns="http://graph2svg.googlecode.com"
			colType="none" legend="top" xAxisDivision="both" shift="0" yAxisDivision="5"
			pointType="star" colorScheme="cold" xGrid='both' yGrid='minor' effect='3D' lineType="solid" 
			xAxisPos="bottom" yAxisType="log">
	<title>Pokusný graf číslo 2 - log osa</title>
	<names>
		<name>Leden</name>
		<name>Únor</name>
	     <name>Březen</name>
	     <name>Duben</name>
	     <name>Květen</name>
	     <name>Červen</name>
	     <name>Červenec</name>
	     <name>Srpen</name>
	     <name>Září</name>
		<name>Říjen</name>
		<name>Listopad</name>
		<name>Prosinec</name>
    </names>
	<values>
		<title>small values</title>
		<value>0.0005</value>
		<value>0.008</value>
		<value>0.02</value>
		<value>0.3</value>
		<value>0.95</value>
		<value>10</value>
		<value>100</value>
		<value>5000</value>
		<value>9800</value>
		<value>40000</value>
	</values>
	<values>
		<title>big values</title>
		<value>90000</value>
		<value>10000</value>
		<value>4000</value>
		<value>90</value>
		<value>1</value>
		<value>10</value>
		<value>120</value>
		<value>1250</value>
		<value>8000</value>
		<value>15000</value>
     </values>
</msgr>